{
  "$schema": "https://json-schema.org/draft/2020-12/schema",
  "$id": "https://github.com/andyguzmaneth/pir-bench/schema/result.schema.json",
  "title": "PIR benchmark result record",
  "description": "One measurement of one PIR implementation at one parameter point. This is the single source of truth consumed by the site.",
  "type": "object",
  "required": ["scheme", "implementation", "params", "environment", "metrics"],
  "additionalProperties": false,
  "properties": {
    "scheme": {
      "type": "string",
      "description": "PIR scheme name, e.g. 'InsPIRe', 'Respire', 'Spiral'."
    },
    "implementation": {
      "type": "object",
      "description": "Which concrete codebase produced this record.",
      "required": ["name"],
      "additionalProperties": false,
      "properties": {
        "name": { "type": "string", "description": "Adapter id, e.g. 'inspire-raven', 'inspire-poulpy'." },
        "repo": { "type": "string", "description": "Source repository URL." },
        "commit": { "type": "string", "description": "Exact commit hash benchmarked (reproducibility)." },
        "forked_from": { "type": "string", "description": "Upstream this implementation descends from. Omit for independent implementations; drives the lineage column on the site." },
        "backend": { "type": "array", "items": { "type": "string" }, "description": "Acceleration this build actually used, e.g. ['avx512f','blas'] or ['avx2','rayon']. Two rows with different backends are not the same measurement." },
        "online_work_scope": {
          "type": "object",
          "description": "What the per-query online answer actually covers. Decisive for reading server_answer_ms: an implementation whose online phase touches a fixed-size shard has a latency independent of N, which looks like perfect scaling but is not the same operation as full-database PIR.",
          "additionalProperties": true,
          "properties": {
            "kind": { "enum": ["full_database", "shard"] },
            "entries": { "type": "integer", "description": "Records covered by the online phase when kind is 'shard'." },
            "leaks_shard_id": { "type": "boolean", "description": "Whether the query reveals which partition the index is in, i.e. whether the anonymity set is smaller than the database." },
            "note": { "type": "string" }
          }
        },
        "framework": {
          "type": "object",
          "description": "Set when the measured codebase is driven by a separate bench framework pinned at its own commit (e.g. inspire-rs measured through raven's b1-inspire). Both pins are needed to reproduce the row.",
          "additionalProperties": true,
          "properties": {
            "repo": { "type": "string" },
            "commit": { "type": "string" },
            "note": { "type": "string" }
          }
        },
        "language": { "type": "string" }
      }
    },
    "params": {
      "type": "object",
      "description": "The benchmark configuration. Rows are only comparable when these match.",
      "required": ["num_records", "record_bytes", "security_bits", "threads"],
      "additionalProperties": true,
      "properties": {
        "num_records": { "type": "integer", "minimum": 1, "description": "Database size N." },
        "record_bytes": { "type": "integer", "minimum": 1, "description": "Size of one record in bytes." },
        "security_bits": { "type": "integer", "description": "Target computational security level lambda." },
        "threads": { "type": "integer", "minimum": 1, "description": "Server-side thread count used." },
        "scheme_params": {
          "type": "object",
          "description": "Scheme-specific tuning (poly degree, moduli, packing params, ...).",
          "additionalProperties": true
        }
      }
    },
    "environment": {
      "type": "object",
      "description": "Where it ran. Two rows with different environments are not directly comparable.",
      "required": ["cpu_model"],
      "additionalProperties": false,
      "properties": {
        "cpu_model": { "type": "string" },
        "cpu_features": { "type": "array", "items": { "type": "string" }, "description": "e.g. ['avx2'], ['avx512']." },
        "logical_cores": { "type": "integer" },
        "ram_bytes": { "type": "integer" },
        "os": { "type": "string" },
        "timestamp": { "type": "string", "format": "date-time", "description": "RFC3339 UTC time the run completed." },
        "runner_version": { "type": "string" }
      }
    },
    "metrics": {
      "type": "object",
      "description": "Measured quantities. All optional so partial runs are still valid; omit what was not measured rather than reporting 0.",
      "additionalProperties": false,
      "properties": {
        "query_bytes": { "type": "integer", "description": "Uploaded query size (per query)." },
        "response_bytes": { "type": "integer", "description": "Downloaded response size (per query)." },
        "offline_hint_bytes": { "type": "integer", "description": "One-time offline download (hint/params), 0 for silent-preprocessing schemes." },
        "preprocessing_ms": { "type": "number", "description": "One-time server preprocessing time." },
        "server_answer_ms": { "type": "number", "description": "Per-query server compute time." },
        "server_throughput_mbps": { "type": "number", "description": "Online throughput: database bytes / server_answer_ms, in MB/s. Present ONLY for implementations whose online answer scans the whole database (props.json online_scans_full_db). Omitted for silent-preprocessing schemes, where the online phase touches preprocessed state and this ratio would exceed DRAM bandwidth." },
        "preprocessing_throughput_mbps": { "type": "number", "description": "Offline throughput: database bytes / preprocessing_ms, in MB/s. Well-defined for every implementation, since the offline phase touches the whole database once." },
        "client_query_gen_ms": { "type": "number", "description": "Per-query client query-generation time." },
        "client_decode_ms": { "type": "number", "description": "Per-query client response-decode time." },
        "peak_memory_bytes": { "type": "integer", "description": "Peak server RSS during answer." }
      }
    },
    "metrics_spread": {
      "type": "object",
      "description": "Observed variation for the metrics above, where the implementation exposed it. Keyed by the same metric names. Kept separate so the headline values in `metrics` stay scalar.",
      "additionalProperties": {
        "type": "object",
        "additionalProperties": false,
        "properties": {
          "min": { "type": "number" },
          "max": { "type": "number" },
          "p95": { "type": "number" },
          "n": { "type": "integer", "description": "How many independent measurements the spread is over." }
        }
      }
    },
    "notes": { "type": "string", "description": "Free-form caveats, e.g. 'single-threaded only', 'estimated from paper Table 3'." }
  }
}
