{
  "scheme": "InsPIRe",
  "implementation": {
    "name": "inspire-poulpy",
    "repo": "https://github.com/poulpy-fhe/poulpy-pir",
    "commit": "625ac4094b2a99b23bc57e44e080dbc2dd526768",
    "language": "rust",
    "backend": [
      "avx512f",
      "private-gemm-x86"
    ],
    "online_work_scope": {
      "kind": "full_database",
      "leaks_shard_id": false,
      "note": "The online answer is over the whole database; no index partition is revealed."
    }
  },
  "params": {
    "num_records": 33554432,
    "record_bytes": 32,
    "security_bits": 128,
    "threads": 8,
    "scheme_params": {
      "variant": "InsPIRe-1GiB-c32768",
      "preset": "InsPIRe-1GiB-c32768",
      "collapse": "Interpolation",
      "ring_degree_n": 2048,
      "interpolation_degree_t": "8",
      "online_repeats": 10,
      "batch": 1,
      "phase_breakdown_ms": {
        "setup": 169.150056,
        "database_fill": 616.599797,
        "query_mask": 1914.015971,
        "offline": 13928.428644
      },
      "noise_log2_max": "-20.809",
      "poulpy_reported_peak_rss_bytes": 10051297214,
      "seeds": [
        0
      ],
      "measured_per_seed": 10
    }
  },
  "environment": {
    "cpu_model": "AMD Ryzen 9 9900X 12-Core Processor",
    "cpu_features": [
      "avx2",
      "avx512f"
    ],
    "logical_cores": 8,
    "ram_bytes": 33646014464,
    "os": "linux",
    "timestamp": "2026-07-29T19:46:02.656Z",
    "runner_version": "inspire-poulpy@625ac4094b2a"
  },
  "metrics": {
    "query_bytes": 460993,
    "response_bytes": 32813,
    "offline_hint_bytes": 0,
    "preprocessing_ms": 16628.194468,
    "server_answer_ms": 36.100162,
    "preprocessing_throughput_mbps": 64.57356666512135,
    "client_query_gen_ms": 1.37087,
    "peak_memory_bytes": 10051543040
  },
  "notes": "Measured on ryzen9900x-8t-32g. security_bits=128 is claimed by the implementation and is published as a label only — it is not verified here. Scheme params are whatever this implementation chose; compare across implementations with that in mind. CAVEAT: poulpy's example averages the online phase over its own REPEATS=10 and exposes no seed parameter, so this row reports a single run with no cross-seed spread, where the raven and upstream rows report a median over 3 seeds. client_decode_ms is not reported by the example and is omitted rather than invented. Independent implementation of InsPIRe on the Poulpy FHE library — not a fork of inspire-rs. Interpolation construction (the direct analogue of the other InsPIRe rows here); the recursive InsPIRe² construction is published separately as inspire2-poulpy because it is a different protocol, not a tuning knob. Requires AVX-512F: the crate's avx512-fhe feature has a compile-time guard and only builds on an AVX-512 host. Database layouts follow the crate's DefaultPirParameters32B presets, which are 32-byte payloads only at 1/2/4/8/16/32 GiB — mapping to entries_log2 25..30. The cols choice per size follows the crate's own examples/README pairing."
}
