{
  "scheme": "InsPIRe",
  "implementation": {
    "name": "mock-hisoka",
    "language": "rust"
  },
  "params": {
    "num_records": 1048576,
    "record_bytes": 256,
    "security_bits": 128,
    "threads": 4
  },
  "environment": {
    "cpu_model": "Intel(R) Xeon(R) Processor @ 2.80GHz",
    "cpu_features": [
      "avx512",
      "avx2",
      "avx",
      "sse4_2"
    ],
    "logical_cores": 4,
    "ram_bytes": 16856244224,
    "os": "linux",
    "timestamp": "2026-07-27T17:37:22Z",
    "runner_version": "0.1.0"
  },
  "metrics": {
    "query_bytes": 15360,
    "response_bytes": 6656,
    "offline_hint_bytes": 0,
    "preprocessing_ms": 536.870912,
    "server_answer_ms": 479.3490285714285,
    "server_throughput_mbps": 560.0,
    "client_query_gen_ms": 1.4,
    "client_decode_ms": 0.8,
    "peak_memory_bytes": 375809638
  },
  "notes": "MODELED metrics (no real cryptography executed)."
}
