{
  "scheme": "iSimplePIR",
  "implementation": {
    "name": "isimplepir-raven",
    "repo": "https://github.com/hisoka-io/raven",
    "commit": "5a899b5dc60c079af5d3914d67c93b9b72859ec9",
    "language": "rust",
    "backend": [
      "avx2"
    ],
    "online_work_scope": {
      "kind": "full_database",
      "leaks_shard_id": false,
      "note": "The online answer is over the whole database; no index partition is revealed."
    }
  },
  "params": {
    "num_records": 134217728,
    "record_bytes": 32,
    "security_bits": 128,
    "threads": 8,
    "scheme_params": {
      "variant": "isimplepir-default-q-setup-owned",
      "throughput_qps_per_core": 3.2442838253593904,
      "seeds": [
        0,
        1,
        2
      ],
      "measured_per_seed": 16
    }
  },
  "environment": {
    "cpu_model": "AMD Ryzen 9 9900X 12-Core Processor",
    "cpu_features": [
      "avx2",
      "avx512f"
    ],
    "logical_cores": 8,
    "ram_bytes": 33646014464,
    "os": "linux",
    "timestamp": "2026-07-29T20:15:47.712Z",
    "runner_version": "isimplepir-raven@5a899b5dc60c"
  },
  "metrics": {
    "query_bytes": 262152,
    "response_bytes": 262152,
    "offline_hint_bytes": 268435488,
    "preprocessing_ms": 264674.418807,
    "server_answer_ms": 242.853,
    "server_throughput_mbps": 17685.461147278394,
    "preprocessing_throughput_mbps": 16.22736082829327,
    "client_query_gen_ms": 62.642,
    "peak_memory_bytes": 17948958720
  },
  "metrics_spread": {
    "server_answer_ms": {
      "min": 242.271,
      "max": 243.355,
      "n": 3
    },
    "client_query_gen_ms": {
      "min": 61.841,
      "max": 63.007,
      "n": 3
    },
    "preprocessing_ms": {
      "min": 264674.418807,
      "max": 264674.418807,
      "n": 3
    }
  },
  "notes": "Measured on ryzen9900x-8t-32g. security_bits=128 is claimed by the implementation and is published as a label only — it is not verified here. Scheme params are whatever this implementation chose; compare across implementations with that in mind. Raven's own iSimplePIR crate (eprint 2026/030), driven through the b2-isimplepir bench binary. Kept as the hint-based contrast to the InsPIRe implementations."
}
