{
  "scheme": "InsPIRe",
  "implementation": {
    "name": "inspire-upstream",
    "repo": "https://crates.io/crates/inspire/0.2.0",
    "commit": "0.2.0",
    "language": "rust",
    "backend": [
      "avx2",
      "rayon"
    ],
    "online_work_scope": {
      "kind": "shard",
      "entries": 2048,
      "leaks_shard_id": true,
      "note": "setup() fixes shard_size_bytes = ring_dim * record_bytes = 2048 records, independent of N. The online answer therefore touches one 2048-record shard no matter how large the database is, and ClientQuery.shard_id is sent in cleartext, so the server learns which shard the query is in. The anonymity set is 2048 records, not N."
    }
  },
  "params": {
    "num_records": 16777216,
    "record_bytes": 32,
    "security_bits": 128,
    "threads": 8,
    "scheme_params": {
      "variant": "inspire-upstream-0.2.0-two-packing-inspiring",
      "crt_moduli": [
        268369921,
        249561089
      ],
      "gadget_base": 1048576,
      "gadget_len": 3,
      "log_q": 55.894465510993015,
      "plaintext_modulus": 65537,
      "ring_dim": 2048,
      "sigma": 6.4,
      "seeds": [
        0
      ],
      "measured_per_seed": 4
    }
  },
  "environment": {
    "cpu_model": "AMD Ryzen 9 9900X 12-Core Processor",
    "cpu_features": [
      "avx2",
      "avx512f"
    ],
    "logical_cores": 8,
    "ram_bytes": 33646014464,
    "os": "linux",
    "timestamp": "2026-07-29T19:55:29.898Z",
    "runner_version": "inspire-upstream@0.2.0"
  },
  "metrics": {
    "query_bytes": 492433,
    "response_bytes": 65658,
    "offline_hint_bytes": 0,
    "preprocessing_ms": 6458.502677,
    "server_answer_ms": 4059.8024975,
    "preprocessing_throughput_mbps": 83.12621962856855,
    "client_query_gen_ms": 4007.583746,
    "client_decode_ms": 0.5600505,
    "peak_memory_bytes": 5551411200
  },
  "notes": "Measured on ryzen9900x-8t-32g. security_bits=128 is claimed by the implementation and is published as a label only — it is not verified here. Scheme params are whatever this implementation chose; compare across implementations with that in mind. CAVEAT: Upstream 0.2.0's query() calls maybe_generate_packing_keys() on EVERY query — there is no session or key-cache API. Raven's fork added pir/session.rs (ClientSession + a packing-key pre-exchange handshake, keys uploaded once and referenced by handle). So client_query_gen_ms and query_bytes for this row include per-query InspiRING key generation and shipping, while inspire-raven's do not. That is a real difference between the implementations, not a harness artifact — but the two per-query numbers are not measuring the same work, and any comparison must say so. CODE PATH: in this codebase respond_with_variant() dispatches OnePacking and TwoPacking to the same function (respond_inspiring), so requesting TwoPacking actually runs InsPIRe^1, not InsPIRe^2. Raven's fork patched this exact fall-through. The row is therefore not executing the same algorithm as inspire-raven's TwoPacking row even though both are labelled two-packing. CAVEAT: Run with 1 seed x 4 measured iterations instead of the 3 x 16 used for inspire-raven. This implementation's per-query cost is ~2000x higher (4.0 s vs 1.9 ms at 2^20 x 8 B on the reference machine), so the default counts are unfinishable at the larger cells. Fewer iterations lowers confidence in the number; it does not change what is being measured. The counts actually used are recorded in params.scheme_params. The pre-fork baseline. github.com/igor53627/inspire-rs — the upstream that inspire-raven and inspire-lianghuiqiang9 both descend from — has been DELETED from GitHub; crates.io inspire 0.2.0 (published 2026-02-15) is the only surviving copy. Its secure_128_d2048 uses the 2-CRT moduli [268369921, 249561089] (q ~ 2^56), which is exactly the parameter set Raven's fork replaced with a single-prime q = 2^60 - 2^14 + 1, calling it under-provisioned. Benchmarked through a driver crate in this repo, since the published crate ships no BenchReport emitter."
}
