{
  "scheme": "iSimplePIR",
  "implementation": {
    "name": "isimplepir-raven",
    "repo": "https://github.com/hisoka-io/raven",
    "commit": "5a899b5dc60c079af5d3914d67c93b9b72859ec9",
    "backend": [
      "avx2"
    ],
    "language": "rust"
  },
  "params": {
    "num_records": 268435456,
    "record_bytes": 8,
    "security_bits": 128,
    "threads": 8,
    "scheme_params": {
      "variant": "isimplepir-default-q-setup-owned",
      "throughput_qps_per_core": 6.136308113234827,
      "measured_queries": 16
    }
  },
  "environment": {
    "cpu_model": "AMD Ryzen 9 9900X 12-Core Processor",
    "cpu_features": [
      "avx2",
      "avx512f"
    ],
    "logical_cores": 8,
    "os": "linux",
    "timestamp": "2026-07-28T02:00:34.759Z",
    "runner_version": "raven-bench@5a899b5dc60c"
  },
  "metrics": {
    "query_bytes": 185372,
    "response_bytes": 185372,
    "offline_hint_bytes": 189812768,
    "preprocessing_ms": 131551.819314,
    "server_answer_ms": 121.895,
    "server_throughput_mbps": 17617.487575372248,
    "client_query_gen_ms": 39.736,
    "preprocessing_throughput_mbps": 16.324241346097907
  },
  "notes": "Measured on ryzen9900x-8t-32g. security_bits=128 is claimed by the implementation and is published as a label only — it is not verified here. Scheme params are whatever this implementation chose; compare across implementations with that in mind. Raven's own iSimplePIR crate (eprint 2026/030), driven through the b2-isimplepir bench binary. Kept as the hint-based contrast to the InsPIRe implementations."
}
