{
  "scheme": "InsPIRe",
  "implementation": {
    "name": "inspire-raven",
    "repo": "https://github.com/hisoka-io/inspire-rs",
    "commit": "5a899b5dc60c079af5d3914d67c93b9b72859ec9",
    "forked_from": "https://github.com/igor53627/inspire-rs",
    "language": "rust",
    "backend": [
      "avx2",
      "rayon"
    ],
    "online_work_scope": {
      "kind": "shard",
      "entries": 2048,
      "leaks_shard_id": true,
      "note": "setup() fixes shard_size_bytes = ring_dim * record_bytes = 2048 records, independent of N. The online answer therefore touches one 2048-record shard no matter how large the database is, and ClientQuery.shard_id is sent in cleartext, so the server learns which shard the query is in. The anonymity set is 2048 records, not N."
    }
  },
  "params": {
    "num_records": 1048576,
    "record_bytes": 32,
    "security_bits": 128,
    "threads": 8,
    "scheme_params": {
      "variant": "inspire-default-q-twopacking-inspiring-commit-e-handshake-solinas",
      "throughput_qps_per_core": 111.75915901232844,
      "measured_queries": 16
    }
  },
  "environment": {
    "cpu_model": "AMD Ryzen 9 9900X 12-Core Processor",
    "cpu_features": [
      "avx2",
      "avx512f"
    ],
    "logical_cores": 8,
    "os": "linux",
    "timestamp": "2026-07-28T02:00:34.001Z",
    "runner_version": "raven-bench@5a899b5dc60c"
  },
  "metrics": {
    "query_bytes": 98840,
    "response_bytes": 32879,
    "offline_hint_bytes": 0,
    "preprocessing_ms": 3513.009624,
    "server_answer_ms": 6.598,
    "client_query_gen_ms": 2.308,
    "preprocessing_throughput_mbps": 9.55147739156891
  },
  "notes": "Measured on ryzen9900x-8t-32g. security_bits=128 is claimed by the implementation and is published as a label only — it is not verified here. Scheme params are whatever this implementation chose; compare across implementations with that in mind. Raven's fork, driven through raven's b1-inspire bench binary. UPSTREAM.md documents 6 local patches, including replacing upstream's under-provisioned 2-CRT moduli in secure_128_d{2048,4096} with a single-prime q, and a CRS shrink from ~34.9 to ~1.1 MiB."
}
