{
  "scheme": "iSimplePIR",
  "implementation": {
    "name": "raven-isimplepir",
    "repo": "https://github.com/hisoka-io/raven",
    "commit": "5a899b5dc60c079af5d3914d67c93b9b72859ec9",
    "language": "rust"
  },
  "params": {
    "num_records": 16777216,
    "record_bytes": 32,
    "security_bits": 128,
    "threads": 8,
    "scheme_params": {
      "variant": "isimplepir-default-q-setup-owned",
      "throughput_qps_per_core": 19.790394979176792,
      "measured_queries": 16
    }
  },
  "environment": {
    "cpu_model": "AMD Ryzen 9 9900X 12-Core Processor",
    "cpu_features": [
      "avx2",
      "avx512f"
    ],
    "logical_cores": 8,
    "os": "linux",
    "timestamp": "2026-07-28T02:00:34.579Z",
    "runner_version": "raven-bench@5a899b5dc60c"
  },
  "metrics": {
    "query_bytes": 87392,
    "response_bytes": 87392,
    "offline_hint_bytes": 89481248,
    "preprocessing_ms": 29309.900575,
    "server_answer_ms": 28.493,
    "server_throughput_mbps": 18842.20376934686,
    "client_query_gen_ms": 20.731
  },
  "notes": "Measured on ryzen9900x-8t-32g. Variant \"isimplepir-default-q-setup-owned\"; client_query_gen_ms includes decode. security_bits=128 is nominal — confirm against scheme params."
}
